70001,Shan Yao Toufu,Fried to golden brown topped with pickled radish and leafy vegetable,14,STARTER
70002,Nonya Curry Fish,"Signature favourite with mix of spices cooked to a fragrant curry broth of soy protein ""fish"" and fresh vegetables",15,MAIN_COURSE
70003,Roast Duck,Hand-made traditional signature and toufu skin and braised mushroom,15,MAIN_COURSE
70004,Black Sesame Paste,Glossy and jet-black color and uniquely rice nutty flavor,4,DESSERT
70005,Ice Lemon Tea,Served in a glass with ice,3,BEVERAGES
70006,Ice Flower Tea,Served in a glass with ice,3,BEVERAGES
